<?xml version="1.0" standalone="no"?>
<!DOCTYPE SMPQueue PUBLIC "-//InterVerdiKom Team//SMPQueue//EN" "SMPQueue.dtd">

<SMPQueue type="InterArrival">
	<ArrivalProcess>
		<SMProcess numStates="X">
			<TransitionMatrix>
				<MatrixValue fromState="X" toState="Y">
					X
				</MatrixValue>
				<MatrixValue fromState="X" toState="Y">
					X
				</MatrixValue>
			</TransitionMatrix>
			<Distribution stateIndex="X" steps="Y">
				<DistValue steps="X">
					X
				</DistValue>
				<DistValue steps="X">
					X
				</DistValue>
			</Distribution>
		</SMProcess>
	</ArrivalProcess>
</SMPQueue>